cpf,nome,telefone_1,mensagem
34767202841,Samuel Garcia,31985708339,"Prezada sam, boa tarde! Espero que esteja bem."
34767202841,Samuel Garcia,31985708339,"ola sam, aaaa! otimo dia."
34767202841,Samuel Garcia,31985708339,"Prezada sam, top demais."
34767202841,Samuel Garcia,31985708339,"kkkkkrai viu, é phoda"
34767202841,Samuel Garcia,31985708339,"Pouhaaa, ta complexo"
34767202841,Samuel Garcia,31985708339,"é foda, mas acontece"
34767202841,Samuel Garcia,31998864303,"Prezada sam, boa tarde! Espero que esteja bem."
